{
  "schema_version": "action.v1",
  "action_id": "5d4c3b2a-1f0e-4d9c-8b7a-6e5d4c3b2a10",
  "run_id": "3b0e8c1a-5d2f-4e6a-9c7b-1f2e3d4c5b6a",
  "trigger": {
    "kind": "finding",
    "id": "2e4d6c8b-0a1f-4e3d-b5c7-9a8b7c6d5e4f"
  },
  "type": "create_sim_ticket",
  "target": "bis.sim_tickets",
  "payload": {
    "title": "Lieferant für SP: Lieferfähigkeit klären",
    "body": "Lieferzeit SP 27,9 statt 19,2 Tage; 84 % des Anstiegs bei einem Lieferanten. Bitte Lieferfähigkeit klären und Ersatz prüfen.",
    "department": "supply",
    "assignee": "person:leitung-logistik",
    "priority": "high",
    "labels": [
      "kpi:delivery_time_avg_days",
      "region:SP"
    ]
  },
  "rationale": "Befund mit gestützter Hypothese (Konfidenz 0,78) zu einem Lieferanten; Ticket an die verantwortliche Person.",
  "evidence": [
    {
      "kind": "finding",
      "id": "2e4d6c8b-0a1f-4e3d-b5c7-9a8b7c6d5e4f"
    },
    {
      "kind": "insight",
      "id": "6f1c2d5e-0b7a-4c3e-9a1f-2d4b6c8e0a12"
    }
  ],
  "autonomy_level": "L1",
  "risk": "medium",
  "status": "executed",
  "approved_by": "admin",
  "approved_at": "2026-10-10T07:42:10Z",
  "executed_at": "2026-10-10T07:42:11Z",
  "result_ref": "sim-ticket:1042",
  "error": null,
  "data_class": "public",
  "created_at": "2026-10-10T02:11:49Z"
}
